parent_id,Body,group2_tech
35212195454,"b'Even in the early/mid 2000s, it was an unspoken rule that middle/high school students who attempted  to take AP or Honors classes without internet access at home would be bottlenecked. Youd have to wake up hours before school started and try to reserve one of the half-dozen computers available in the library. I remember failing a few assignments because of students who would hog those 6 or 7 computers to play games, edit their crappy skate tapes, or watch flash animations. Students who had internet home had a huge advantage over the ones who didnt. And that was 20 years ago. I cant imagine what thats like now.'",n
34531758127,b'But check this out. \n\nhttps://www.google.com/amp/s/www.livescience.com/amp/cdc-combined-covid-19-diagnostic-and-antibody-tests.html',N
33237940881,b'[Regerts*](https://www.google.com/search?client=firefox-b-1-d&amp;q=no+regerts+tattoo)',N
35871443186,"b""&gt;Eventually theyre going to be playing the same stuff as kono.\n\nWhich is ironic, because I figured a station like KONO would be the one with the, for lack of a better term, permanent playlist of music from a certain time period.\n\nWhat I thought was really funny, though, was that as I was talking about this on Facebook, a high school classmate from the town where I grew up told me that the local oldies (think '50s and '60s rock) station recently switched to '90s alternative....""",N
39861902912,"b""How exactly am I wrong then, if you can't explain how I'm wrong and just go straight to insults then you're just an over sensitive idiot""",N
27734941213,b'Pest control tech here can confirm this.',N
29199608022,"b'So you\'re saying it\'s what he didn\'t say rather than what he did say? At least that makes sense. But if that\'s the truth then our society is breaking down more and more everyday. Why do you feel the need for gratification and support from a man you don\'t know and will never meet? I still stand behind my statement that people are looking for things to get offended about, and it\'s a damn shame. That\'s like saying it\'s my birthday and I get a phone call telling me I should eat cake. Sure it may be unconventional, but I\'m sure as hell not gonna get upset over something so petty. The fact that they took the time out to even call is better than what most people do. I realize it\'s his job, but be grateful he even talked about it. I personally believe women\'s day, black history month, Hispanic heritage, and the lot are very sorry holidays. It\'s saying ""we were mistreated so now recognize us"" well maybe it would go a lot more smoothly if instead of boasting about it you fight for true equality. Don\'t expect men to open doors for you or not hit you when you swing first. I was raised a gentleman of Texas quality, but after experiencing life and the equality fights, it\'s only fair to have TRUE equality or none at all. That being said, you don\'t need a holiday to stamp your mark on history ""you know it, I know it, everybody knows it"" therefore it can only be used as a medium to attract sorrow and attention. I\'d like to hear your take rather than massive down votes this time, because that action goes hand in hand with what I\'m saying right now. '",n
29685647447,"b""Nah, I don't agree with this law, but if you're the dope in front of me sitting still at a green light because you're staring at your phone, I'm imagining shoving that phone up your ass.""",N
27449245569,"b""Great idea about the Facebook pages! We called shelters, but we'll definitely try that too. Thank you!!""",N
28732553716,"b""You are not making much sense. First, a huge percentage of the Rackspace workforce is from San Antonio, born and raised, and Rackspace afforded them the opportunity to stay in the city they love.\n\nSecondly, if you are looking for an exploitive puppeteer of city hall, you are looking in the wrong place and your real battle is with the tourism industry. You know what the tech industry hasn't done here? Bulldoze entire neighborhoods to create unused ego trophies like Hemisfair and the Alamodome. You know what Rackspace doesn't do? Exploit a minimum wage workforce as profits are relocated to headquarters in Dallas and New York.""",n
40725968127,b'People in San Antonio go nuts for free things. \n\nI mean how much does a tree even cost?  20-40?',N
26244353104,"b""Cheaper for the tax payer (maybe).  We didn't pay for jail processing, baloney sandwich or seatless toilet time.  I wonder if its break even on the technology.""",N
29643603325,"b""Obviously I'm gonna be a bit biased, but I honestly think people would enjoy it regardless of if they're into anime or not. We market as an anime convention, sure, but that's not what we're all about.\n\nThis year our theme is Fantasy/RPG, so we've got this big ticket Final Fantasy concert and related. There are a lot of people coming out for that who are interested in the franchise and/or orchestral music (https://ffnewworld.com/concert/sanjapan/). \n\nSpeaking of music, there are a lot of people who come out for our musical guests. Entrance to Teddyloid's set and the ALL OFF concert are both included with the badge you purchase. Give 'em a listen, if you're into that.\n\nWe've got a lot of gaming content, as well! Video, board, table top, card, whatever, you name it. Not only do we have free play areas where you can enjoy things with friends (or make new ones), we've got scheduled tournaments as well. And we even have this neat retro game museum that people are free to peruse and even play a few consoles in.\n\nPlus, I know a lot of people who go just to participate in fandom meetups/panels (which again, aren't just restricted to anime fandoms). If you're really curious, I'd suggest taking a quick peek at the schedule (http://san-japan.org/events/schedule) to see if there are things there you might be interested in. Note that doesn't contain our gaming schedules, or the stuff that's open regularly like karaoke or the retro game museum. \n\nAlso, there are also a lot of people who go just to enjoy/interact with/take pictures of the really awesome cosplays we get. I don't always know the fandoms, but we can all appreciate a well made cosplay. The cosplay show is wildly popular.\n\nI know literally the most basic of basics about anime. Like, Dragon Ball Z and Sailor Moon are about as far as I ever really got. But I have a sincerely awesome experience at SJ every time, which is part of the reason why I've been helping to run it for the past few years. I could literally go on and on about all the content we have at San Japan (that's my job at the con, I manage/coordinate most of the programming that goes on), but these are some of the highlights. Hope this helped to answer your question (even if it was a little bit lengthy)!""",n
39357974837,"b'Even the 911 center for the city is hiring now. Starts at $19.27 for call takers. All you need is ged or diploma, one year of experience with the public in person or over the phone, can type at least 35 words a minute and pass background check. Even get paid during classroom and on the job training. But honestly everyone getting hired now will probably get placed in afternoon or night shift with no weekends or holidays off due to seniority.'",n
36492607872,b'You are just so blatantly wrong. \n\nhttps://www.google.com/amp/s/www.uchealth.org/today/the-truth-about-asymptomatic-spread-of-covid-19/%3Famp',N
37597876253,"b'Yeah, I know you. Watch out. The black helicopters are circling as the Illuminati listen to your phone calls.'",N
36261516785,"b'From your link:\n\nhttp://sat.ahasalerts.com/ActiveAlerts.aspx?id=2042\n\n&gt;THE STATES ELECTRICAL GRID IS AT A CRITICAL STAGE AND ERCOT SAYS THEY ARE IN JEOPARDY OF LOSING THE GRID. ALL UTILITIES, INCLUDING CPS, WILL BE AFFECTED.\n&gt;\n&gt; ROTATING OUTAGES WILL BE INCREASING IN BOTH LENGTH AND FREQUENCY.\n CRITICAL CIRCUITS WILL NOW EXPERIENCE OUTAGES. THERE IS A VERY HIGH PROBABILITY THAT ALL CUSTOMERS INCLUDING CRITICAL CUSTOMERS SUCH AS HOSPITALS WILL BE AFFECTED.\n WE HAVE NO CERTAINTY OR ABILITY TO PREDICT DURATION OR FREQUENCY OF OUTAGES DURING THIS CRITICAL STAGE.\n RESTORATION EFFORTS HAVE BEEN SUSPENDED UNTIL THIS EMERGENCY SITUATION HAS IMPROVED.\n PLEASE REDUCE YOUR THERMOSTATS TO A MAXIMUM OF 62 DEGREES\n&gt;\n&gt;CUSTOMERS ARE BEING ASKED TO IMMEDIATELY CONSERVE ELECTRICITY AND NATURAL GAS. CUSTOMERS MAY ALSO SEE A LOSS OF WATER, AS WATER SYSTEMS RUN ON ELECTRICITY. WE ARE TRYING TO MAINTAIN THE INTEGRITY OF THE GRID AND AVOID A ERCOT-WIDE BLACKOUT. CUSTOMERS CAN STAY UP-TO-DATE ON THE CPS FACEBOOK AND TWITTER PAGES AND CAN ALSO MONITOR POWER OUTAGES AND REPORT THEM ON THE OUTAGE MAP AT OUTAGEMAP.CPSENERGY.COM/\n&gt;\n&gt;\n&gt;END OF ALERT'",N
34277569853,b'Im in the same boat as you I miss the gym a lot I go 6 days outta the week but Im not gonna work all day then go and stand outside of the gym for an hour to an hour and a half \n\nIm calling tomorrow but Im definitely prepared to be on the phone for 30 minutes listening to them tell me its not gonna be bad all because their bosses are losing money and dont want me to pause',N
40221468380,b'Not to mention the growing tech-sector hub near Port of SA.',N
36227692996,"b""Yeah, I was shocked by the email that they'd left, but someone in a group I'm in on Facebook mentioned the new group and when I checked the website there they were!  From the sound of the receptionist who called me, it sounded like they took a lot of their office staff too.""",Y
40136880944,b'There was a post a week or so ago that said pairing a dehumidifier with the ac really helped.',N
34708196491,"b""I think the solution I'm going to have to use is to grab an old phone and set up a hot spot, and leave the phone in the house. I hope that is enough for me to be able to work from home. :(""",Y
36160661649,"b""You can also check to see if AT&amp;T Fiber is in that area. Rates are similar to Google's""",N
39824475506,b'call center agents doing tech support',N
41011091935,b'[deleted]',N
35858972908,"b""After this year we all are, hang in there. You also might want to review the phase 1b conditions. [Texas is expected to start phase 1b in a few weeks](https://www.google.com/amp/s/www.kxan.com/news/coronavirus/phase-1b-those-65-and-up-people-with-select-medical-conditions-to-get-covid-19-vaccine-next/amp/). Hopefully you aren't a higher risk but help is coming soon if you are.""",n
42174557317,b'Haha fair enough. So then its either illiteracy or laziness. Neither of which am I willing to pay for.',N
40726680343,"b""Yea there were 2 of them in Ohio that I knew of. They're all over, or used to be at least.""",N
42172323545,"b'It affects the Mom and Pop businesses, too, though.  And have you thought about the poor people with no transportation having to travel miles away just to shop?  Its kind of elitist to say, yay, so glad the Walmarts are leaving without considering the people who need to shop there.'",N
26425546310,"b""I am not completely bilingual, but I am fluent.  I also had a business concentration in my Spanish minor.  It would qualify me for a few things, but I'm not sure about offering tech. support on the phone...\n\nIt made me a valuable asset at my former employment in northwest Arkansas, where there is a HUGE Hispanic population.  I was always being called up to the front to offer assistance to someone who couldn't speak English.\n\nThanks for the feedback.""",N
35073296148,"b""I tried it as both and same thing. Must be something specific in the order with Google's ~~logarithms~~ algorithms yada yada I need sleep""",Y
33936859839,b'https://www.google.com/amp/s/mobile.reuters.com/article/amp/idUSKBN20P01K\n\nhttps://slate.com/tag/coronavirus-diaries\n\nhttps://www.worldometers.info/coronavirus/country/china/\n\nhttps://youtu.be/OOJqHPfG7pA\n\nhttps://www.nytimes.com/reuters/2020/03/22/world/asia/22reuters-health-coronavirus-china.html',Y
33913918887,b'I work at AT&amp;T and apparently were essential. People just HAVE to come in and chance getting infected so they can upgrade their phone right now.',N
29718938052,"b""I refuse to be friends with any 726ers other than the 726er who has their version of my phone number. lol.\n\n726ers haven't even been born yet and they're already dead to me. :-p """,N
40428287296,"b""Did Bob Tips ever find that girl's corpse that someone took home to fuck?""",N
41540434593,"b'&gt; the budding tech scene downtown\n\nthere is no tech scene downtown or anywhere in SA unless youre military.\n\nsincerely, a tech guy.'",Y
30949567320,"b""Dillon: At least 90 percent of the stories that seem to good to be true are just that and end up not seeing the light of day. Often times, a story starts small and doesn't get big until we get involved. That's something that we take pride in: A story that generates action or response. \nTim: Stories that come from sources tend to pan out more than stories that come to our tip inbox or via phone.""",N
30594457436,"b""HIT UP THAT WATERSAVER LANDSCAPE COUPONNNNN\n\nApps reopen August 15th :o)\n\n[http://www.gardenstylesanantonio.com/coupons-and-rebates/](http://www.gardenstylesanantonio.com/coupons-and-rebates/)\n\nGet an irrigation consultation this summer if you have an in-ground irrigation system so you have it done when the application reopens (it's a pre-requisite for those with irrigation doing the coupon program). They're booking appointments in early/mid August rn. """,N
30554099489,"b'Wake up please. The actual issue is that law enforcement officials are arresting people for using a fucking video camera. Its a hard job for Christ sake. Sometimes you might get heckled, sometimes you might get shot. But if you dont realize that before you become a cop, youre more likely to end up being one of those brave men in blue that beats up a young girl or kills a guy holding a cell phone. Stop siding with psychos that think they write the law and are above it please. '",N
39329390542,"b'I called once to ask about pricing options on beds. Whoever answered, assuming it was him, rushed me off the phone saying something like he had real customers to talk to. I was literally just asking about the options in the store to plan a trip to it. Fuck him.'",N
27491245472,"b""I know clearance can be a PITA, but he's been through it before, IIRC. (former nat'l guard) I do know of USAA and rackspace, but I didn't get the impression that they hired out of state unless you had a lot of experience/SR positions. We'll definitely send apps to them though once he's done with these two certs. Thank you again!""",N
34577716627,"b""&gt; Use of a drone, for personal or professional purposes, is not permitted anywhere at the Alamo Complex, including on Alamo Plaza, without an approved permit application.\n\nGood enough for me. Simple lesson: Do a Google search to see if there are guidelines mentioned that aren't disclosed in maps / apps.""",Y
37694664043,"b""You might be surprised to hear that I agree.  Indeed it does affect other people, as does driving on the interstate, not adhering to a wholly healthy diet, going out once a week to treat my wife to a nice steak dinner, failing to exercise as often as I would like (between you and me), so on and so forth.\n\nIt's the price of freedom, friend.  Your decisions are never consequence free.  Your brand new iPhone and your brand new Nike's comes at the price of child labor, electronics you purchase largely contribute greatly to pollution, so on and so forth.  \n\nIt's not easy, I don't have all the answers.  But I won't deny my kids of a quality education and potential poor mental health due to some ghost of an argument for which the science is not yet concluded.  As always, I'm open to correcting my current position to protect primarily my kids but also to keep my community safe.  So far, I haven't encountered anything close to warranting that.  Cheers.""",N
35646512647,"b'They can check phone and social media data. At one point in December we are going to have ration of care, unfortunately the irresponsible 20 to 60 somethings will be ahead for treatment before the 70/80 who was just minding their own business in a nursing home, or the essential workers that were just doing their jobs. So I would love to see a first pass based on following CDC guidelines, like it is done with organ transplants.'",Y
38283807678,b'[removed]',N
29825238221,"b'Really? I always thought of it as Computers 101, lol. Well, at least, it was one of the first things I learned apart from Solitare. '",N
39892888459,"b""As a licensed vet tech I agree. Older meds that are otc dont work very well anymore due to pesticide resistance.  Also you will only see 5 percent of the fleas on your pets. The rest are in your house. In your carpets  even in the grout of your hardwood floors. Also fleas carry tapeworms.  Also if you do get you pet spayed or neutered,  try and get blood work done first. Otherwise you wont know there might be a liver issue until your pet either dosent wake up, or has a bad reaction to anesthesia.  I've been working in the field foe about 8 years and took a year off due to burnout and health, hopefullyngoing back soon. Good luck yall""",N
36543366451,"b'My comment was referring to the Google link, but never mind, I see the gold Fredericksburg line that heads downtown hiding behind the blue line.'",Y
26985753187,"b""It doesn't matter what year it is. Not everyone has a cell phone or camera with them at all times. That's an idiotic assumption.""",N
36818791542,"b""I know all too well. I deal with it daily &amp; know it's a pain in the ass expense! If you want any additional information or would like a free estimate/consultation shoot me a private message and I can arrange that for you. If you're interested in researching the company I represent, we are called Rio Blanco Roofing &amp; Restoration and we are local to San Antonio. I encourage you to check our Facebook &amp; Google for customer testimonials \n\nStorms like these bring out the worst of our industry &amp; there are companies a plenty that make all contractors look bad, so make sure you're checking those reviews for anyone you are considering. Anyone can get BBB certified these days""",N
37336006563,"b'Hate crimes rose significantly under Trumps presidency, with Texas being one of the states with the most hate crimes. https://www.google.com/amp/s/www.newsweek.com/hate-crimes-under-trump-surged-nearly-20-percent-says-fbi-report-1547870%3famp=1 \n\nNot all trump supporters are white supremacists but white supremacists are much more likely to be a Trump supporter then a Biden supporter. Violent and non-violent white supremacist groups alike are very vocal Trump supporters. \n\nIf theres a massive Trump rally, the chance that one or more violent white supremacist is there is higher then any other public gathering (aside from a straight up kkk meeting).\n\nI have been called a kike multiple times while walking my dog while wearing my Jewish star necklace, I have had swastikas painted on my door more then once. When I was living in the Boston area two years ago, significantly more liberal, there was attempted arson on two rabbis houses just 10 minutes away from me. Just recently, a rabbi was stabbed in a hate crime near my old Boston neighborhood. A group of white supremacists yelled The Jews will not replace us while counter protesting in Charlottesville just a few years ago. The Tree of Life synagogue shooting was the largest massacre of Jews in the USA. All of this and more happened during Trumps presidency. \n\nDo I know that every person perpetrating those hate crimes was a Trump supporter? No, I cant be certain. But hateful people felt emboldened during his presidency and thats terrifying to me. \n\nAm I biased? Clearly. But that doesnt make my lived experience any less real or the FBIs data any less factual.'",N
39952396635,"b""2010 crash mandated in 2013 from what I was able to Google. Good call, more accurate statement is its been that way since I've been in the field. Definitely a factor for the shortages but you can get your restricted ATP at 750 hours. Right now most carriers to include majors are hiring at restricted ATP levels. There's more talks on other waivers or rumors of mil competency tests in attempts to combat the shortage.""",Y
28858437048,"b""/u/stewsky  \n  \nIt'll likely be similar to another wireless service I had read about, though I cant recall the name of the service:  \n  \nLarge directional antenna on a neighborhood hub-home, hub home has directional antenna's to other individual homes. With the right wireless tech, I could see this being quite fast.  \n  \nConsidering I can get ~30ms ping and ~100+mbps on LTE, I think a more powerful, directional, wireless tech could carry much more bandwidth and with great stability.  \n  \nLTE signal is broadcast in all directions, with a single transceiver connecting to hundreds if not thousands of phones (Which are small and battery-powered) and yet capable of getting great results. Even when I am moving at 65mph on the highway. Now... Increase the size of the client antenna, increase the broadcast power, make it directional, and stationary.  \n  \nThat should just about take care of your concerns about latency, jitter, and slow speeds. With the hub/relay helping with issues of deadzones. The last concern is frequency congestion (something I know a bit about, trying to have my own wifi in an apartment complex)... I dont know what frequencies they have access to, if they own any spectrum, or what's legal to use in what way, but if Google says they can do it, I can take that small leap of faith.\n""",Y
35512200163,"b""This is what Google Maps shows from (mostly) the same direction:\n\nhttps://i.imgur.com/jW8zmeI.png\n\nI couldn't quite get the same angle, but you get the idea.""",Y
34524857251,"b""They can help with that over the phone right now! They're just opening for curbside and appointments this week.""",N
32449280352,b'Thank you so much!!!! I found exactly what I was looking for thanks to your link and reply! for some reason google kept giving me ads for private schools.',N
30934466983,b'Good point. I imagine many have it set up at the dealer and then buy a new phone down the line and have no idea how to sync it.',N
42040677824,"b'Im sorry you were blind sided. That really sucks. Maybe some of the other suggestions can help put down the road. \n\nHonestly, tax season turns me into a less than pleasant person to be around because its stressful. The money is set aside in our case as we pay estimated taxes, but wrangling in all of our paperwork and deductions is never fun. QuickBooks has helped a lot, but it can be expensive. The version we use for business is now $90 a month. But it does a lot of other things as well and this is way overkill for the avg person. \n\nIm getting better as Ive been through many years of filing and paying now but man, back before I was more organized and had years of experience, I could turn into a bear in late March through April and sometimes late Sept-Oct when I needed to file extensions. \n\nIts too bad tax prep services maybe arent as transparent with pricing? Not sure since ai dont use them, but its like when you go to the doctor and trying to sort through their fees and you just dont know because there is no pricing transparency. The shock of this norm is what puts so many people in financial binds because youre pretty much at the complete mercy of the system, or lack thereof.'",N
37348516891,"b""I'm on a computer, so that may make a difference with navigability.  Try clicking on date range availability; that shows a calendar.  Choke Canyon State Park is about an hour &amp; a quarter from here but it looks like it might be your best bet if you're concerned with water availability.""",N
30503900740,"b""It was built in 2003, but the insulation is awful. It's been a rental property since 2007 until I bought last December, so basic maintenance hasn't been done since. I cleaned the evaporator and condenser coils last week which brought down the coil temps down by about 5 degrees, but I fear I'll end up blowing in some fresh insulation and calling out a 4th HVAC tech before fall.""",N
39630959845,"b""So many of our constitutional rights are not literally in the constitution but have to be interpreted as technology advances and societies change. That's the beauty and the problem with the constitution being so general. But yes a literal amendment protecting the right to abortion is needed.""",N
34057514170,"b""&gt; I have no idea but I'd be curious to know\n\nMe too.  I see apps that claim to be more accurate than others, but I don't think there are 20 different satellites out there measuring weather data. \n\nWeather.gov might be a good start. I don't check the weather enough to know if this is more reliable than others though.\n\nhttps://forecast.weather.gov/MapClick.php?lat=29.553655510179613&amp;lon=-98.55182603381888""",Y
