parent_id,Body,group2_tech
36511971386,"b'&gt; One if the best explanations I\'ve seen in regards to why the 15 minimum wage needs to be deeply reviewed before implementation.\n&gt; \n&gt; https://youtu.be/RZiFdfxXxn8\n\nI\'ll have to watch that at home. It\'s blocked here for hate speech or inflammatory content.  (didn\'t think youtube allowed that?! - my company is pretty conservative though so maybe it\'s a tenacious sysadmin adding shit to the filter?)\n(Reading the CBO report)[https://www.cbo.gov/system/files/2021-02/56975-Minimum-Wage.pdf] on the effects of minimum wage is actually pretty interesting.  It strikes me as it will generally be a boon to the country and our people.  \n\ntl;dr - a little more income to the lowest earners is generally spent in the local community. Food, home improvements, electronics, clothing, vehicles, etc.   It basically stimulates the local economy.  That stimulates the business owners they buy from, and that stimulates the tax coffers of the municipalities, and that leads to better roads and schools and police and fire departments and other services people depend on.  It\'s a trickle-up effect. \n\n\n\n&gt; The problem with liberal policies is that they come from a place of good will but in practice don\'t function at all. If you want healthcare and education stop sending troops overseas, stop bombing foreign countries, stop forcing the economy to be energy dependent on foreign entities, stop having people like aoc vote on bills to supply other nations with gender studies money and put all of that back into the national economy and workforce.\n\nI agree that liberals are a generally a little too hawkish for my taste, but I hope that\'s merely pandering.  It seems like many progressive politicians ARE talking about reducing troops overseas and not be so eager to go to war. The benefit would be that we could better afford to actually care for our veterans. The last four years have been rough on veterans AND active duty alike.   I guess what I\'m trying to say is that the progressives I see are advocating for reduced military spending and reliance of foreign entities (domestic oil, solar, hydro and wind power was big even as far back as 2008 under Obama, so reducing the foreign reliance is there, and hopefully growing).   These liberal policies have proven themselves to actually work. \n\n\nTrump signing the Omnibus bill with the USAID ""(gender studies)[https://www.usaid.gov/pakistan/cross-cutting-themes-good-governance-and-gender-equity]"" package actually surprised me.   I am a big fan of finding out why there\'s so much violence against women there, and how it can be reduced  (overly simplified, I suspect religion and education. Reduce the former and increase the latter would do wonders).  At the same time, I am really interested in how we can reduce foreign aid in general. \nWe spend billions every year on Israel and Egypt and Pakistan and several other countries.  If we could cut that in half (and billions to Israel - an apartheid country? That seems a little counter to our values!) we would have plenty of money for healthcare and education for our own citizens here at home. \n\n&gt; \n&gt; The only people that benefit from a minimum wage increase are the massive corporations that can withstand the reduction in profit. Ie amazon, google etc. The same people that made billions off of covid shutdowns are the same people supporting the politicians backing these policies and are trying to silence free speech.\n&gt; \n\nWell, they lobbied against it hard, until the bad press cost them more.  Then they found out (in the case of Amazon) that offering decent money gave them a lot more and a lot better applicants, so they actually do benefit from it.  And then GOOD press they get for tweeting things like ""we challenge our competitors to match us, or one better, pay $16 and throw the gauntlet back at us"" as I think Bezos or some Amazon dude tweeted.  Hell, BofA pays $20. \n\nUltimately I think we\'re in the wrong here thinking that raising the minimum wage should be so low nobody can live off of it, so we don\'t accidentally give large corporations more money.  That\'s punishing people to try to spite a large corporation.  That\'s not good either. \n\n\n\n&gt; It makes THEM money, not the private citizen. I always find it ironic the left is ""fighting fascism and the establishment"" when mainstream media, social media, big tech, higher and lower education are all owned and operated by the left. How much establishment is left to fight against?\n\n\nUhh.  You might want to read the book ""[Dark Money"" by Jane Mayer](https://bookshop.org/books/dark-money-the-hidden-history-of-the-billionaires-behind-the-rise-of-the-radical-right/9780307947901) - it details how pretty much all the entities you mentioned have large influx of both money and influence by conservative causes.  Certainly not all, but overwhelmingly. \n\nThe very point paragraph you wrote above indicates that they\'re successful in keeping it hidden from \'common knowledge\'. \n\nI\'m a capitalist and a fan of The Nordic Model, so I really don\'t have too much of a problem companies making good money, as long as the people are also lifted by the rising tide.  THAT is what I want to ensure happens, and that\'s why I pin my hopes on some of the progressive politicians that seem to think of it in a similar way. \n\nMake people richer and their communities will thrive, and if they thrive, they spend more money and then the companies thrive, and they can pay their employees and then we have a virtuous circle.  It\'s a little like the tax rates back in the 40s and 50s - a time when the US was truly a superpower with infrastructure and innovation coming at us fast. \n\n&gt; \n&gt; You elevate the community by elevating the individual. You don\'t elevate the community by taking from those that work and giving to those that don\'t. Wealth redistribution (covid ""relief"" packages where only 8% actually goes to covid relief) does not work. You\'re telling people they know nothing about economics but you need to learn some history my friend. Socialism and communism never work.\n\nThis is what I\'ve been trying to say.  The last four years of grift has just impoverished the large masses, while enriching the very few at the top - the very wealth distribution you\'re against (see the Trump Tax Cut as a prime example - yikes!).   We need to encourage people to work and part of that is to ensure that they get paid for it and not just screwed over by the companies they work for. \n\nI don\'t actually know how little of Trump\'s relief was helpful or went where it should have, but the recent plan has a good chunk of money going to actually get people past the pandemic.  Or hopefully will. \nThe part about 8% seems a little shady.  By the time you figure in over 400 billion in stimulus checks, almost 250 billion for unemployment and federal supplement, and 130 billion for safe school reopenings, and 160 billion for vaccine production and distribution and PPE, we get pretty far over the 8% number you quote. \n\nThere are some people that are concerned that the childcare credit isn\'t COVID related and shouldn\'t be in there, but the people who qualify for this are also largely overlapping with people who would benefit from an increased minimum wage, etc. \n\nEconomics.  The ultimate ""facts don\'t care about your feelings"" subject.  :D \n\n\nSocialism and communism might have their downside.  I don\'t think we\'ve seen TOO much communist tendencies, despite the last four years (that\'s more despotism, nepotism and cronyism).  Socialism is something that is huge in our country (the US - I\'m assuming you\'re American here).  Look at the military - stripped down to its core, it\'s a jobs program. \n\n""Give us x amount of years to do what we tell you and we\'ll give you housing, insurance, food and clothing"". \n\nWe have social security - it\'s in the name.   My taxes pay for schools, sidewalks, police and fire departments and infrastructure. Some of which I\'ll be lucky to never use.   I\'d argue that it works, but could work better.   \n\nIf we could reign in some of the pork in the bills and eliminate lobbying and cronyism and grift from government, aka ""draining the swamp"", it would probably work a whole lot better.   I keep referring back to the last four years, because they have been a prime example of how to do your best to ruin a country by grift and theft and shady alliances, instead of doing what\'s better for everyone. \n\nNow we just need to keep voting in better politicians who actually have OUR interests at heart, and toss them out the moment their lies and bullshit comes to light.'",N
36834840139,"b'Yes.  One large one and a small hole in the wall gold mine.  If you search google, you can probably find pics of the gold mine.'",Y
42148848973,b'A women via Facebook I connected with left it on her porch for me. They are helping me try and find a rescue to take her.',Y
30879589548,"b'Are you talking about national or local sources for your forecast? In terms of national sources (AccuWeather, weather.com, Weather Channel), many employ computer-generated methods when forecasting for their broad audience. This can lead to highly inaccurate forecasts. Meanwhile, at KSAT, our 5 meteorologists on staff have a uniform forecast -- a smaller area to forecast for = higher accuracy.'",y
28431106468,"b'I love what I am doing. I interface with VP/SVP/CxO types and at that level there is a bit of politics that come into play, but nothing unmanageable.\n\nLearning new languages is just picking up the syntax and best practices. If you know logic, data structures, and how to build apps the rest is easy.\n'",y
41580592424,"b'A Spurs game sounds fun for me, but only Im a sports fan unfortunately. Thanks for your suggestions!'",N
27423660393,"b'From the article : "" But the Tobin Center is offering a special presale opportunity now for the Tyson event. Click here and use the promo code COSMOS, which is valid for purchasing tickets online, in person or by phone at 210-223-8624. Tickets look to start at $47.50, with meet and greet tickets at $165.""\n\nI\'m guessing you can buy them in the Tobin Center website now with the code? '",n
41881631795,b'You sound like a commie. Private property cant exist unless that property has boundaries. Otherwise all your property is fair game for others to use since you believe all property is yours.',n
41640231520,b'Could be. But why not at least have the little paper notice that gives you the coupon details and a barcode to scan with your phones app?',y
42067673155,"b""It's $3 and worth the upcharge.\n\nGoogle it.  They have multiple formulations.""",Y
28861829340,"b""If your phone has a tuner there's usually an application pre-installed. If not there are internet radio apps of all kinds out there. My Galaxy S4 came with AntRadio but I've never used it.""",Y
29507986347,"b""You might be able to look up the facebook page HYENA: Central Texas Women's Hiking Group. """,Y
39950253124,"b'Good questions, as far as IBM taking over Red Hat, Ive noticed red hat focuses more on kubernetes/openshift as the product is being adopted by lots of customers, I do not think IBM has negatively effected Red Hats direction or the quality of the products, as far as the Rackspce, the people who owned it before didnt want to get too involved in it anymore after I he company grew in size, basically the cloud war is hard to fight when comparing to aws, azure and google cloud.'",y
34794112702,"b'Lets be realistic here. People are likely to see the collection of that data as a violation of their privacy UNLESS they know they have the virus. Its easy to say lets be proactive instead of reactive, but that is not the way to do it. How about people just check their voicemail and return phone calls?'",N
37905270352,"b'There is a massive shortage of chips and a massive demand for GPU\'s (computer video graphics cards). These are used by gamers to play video games on computers, but they have been exquisitely difficult to get as they are now being used also for mining cryptocurrencies. The use the GPUs computing power to get crypto coins, some ""miners"" have dozens of cards because they produce plenty of money. \n\n&amp;#x200B;\n\nFor example a card for sale tomorrow, could be sold for 800-1400 dollars, and if you use it to ""mine"" cryptocurrency you can make $5-12 dollars daily from these cards.'",Y
39590008006,b'This is the current plan',N
41241945163,"b'The answer is yes. They really don\'t think the lower/middle class as two separate entities will exist much longer. There will be slaves and dead people, and they will take ""elite"" to a level that even ""meta"" can\'t describe. Read: [https://rushkoff.com/books/survival-of-the-richest-escape-fantasies-of-the-tech-billionaires/](https://rushkoff.com/books/survival-of-the-richest-escape-fantasies-of-the-tech-billionaires/)'",N
40793145494,"b""The difference is 5g.   The more you compress the data stream the more data you can transfer via radio.  Instead of adding another cell, your 5G phone makes it easier for the cell to transfer the data. \n\nRemember non digital phones when calls would bleed together?   Of course that was before every city got divided into cells...   So maybe you don't.""",Y
36282707290,"b""I agree that they prevented something worse, but they did it the wrong way. Shutting down neighborhoods, and advising people to use as little energy as possible was not enough when I know there were car dealerships, phone stores, skyscrapers, and empty businesses that were nice and toasty with no one inside. Get the owners to flip a breaker off, turn off a light, or turn down the heat. \n\nThey were willing to ask the people freezing to death to do it, but not ask or force businesses with full power that weren't open.\n\nThey could have had more targeted shut downs, and if not they could have had more targeted energy conservation. They also could have been prepared in the first place. Regardless, charge it to the people in control at the top, not the people were not warned, suffered, and still were expecting to 'conserve'.""",N
39554565044,"b""Actually, some people send him messages on Facebook and he just made excuses there. He has a reddit account, so he could talk here to the people instead of just making a statement and leaving it there. I think this is the problem that he doesn't even want to talk to anyone on here and he asks people to come to him instead.""",Y
41518832274,"b'Okay, this is what Google gave me:\n\nhttps://www.snopes.com/fact-check/ashley-biden-diary-afraid/'",y
26409255354,b'Thanks. I did google but all I got was a bunch of E3 articles unsurprisingly',y
32585438543,"b""&gt; Did you think it was just a saying? :)\n\nYes, I honestly did :L \n\n&gt; You haven't been here all summer with 100 degree temps, humidity and still no rain!\n\nI had to google what 100F is in Celsius, and I think you're right. Thank goodness I'm only here for two weeks. \n\nI can't ride a horse but I'm more than happy to pronounce it TAHcoh ;)\n\nFair deal on the trucks issue. I've just never seen so many before.""",N
30520159047,"b""SAPD doesn't enforce any laws besides speeding and sometimes DWI's.   \nIn cities like San Francisco they on a regular base enforce red light runners, they stop people for being on the cell phone at all times and even stop people that have a out of state plate.   \nSAPD should be able to do the same especially the vehicles that are out of the country as they in many cases don't have a Texas registration or insurance.    \n    \nUnless we get a new chief of police, this won't change anytime soon. And if we ever enforce these things, accident rates should go down by 70%.""",N
39219852594,b'I posted a comment with more info. Or Google SAWS landscape coupon and it should be the top result.',y
39859480703,"b""Part of betos campaign was literally taking people's guns. Like he himself fucking said that he planned on it. Not to mention if you dont see the pattern of fed orchestrated shootings then you're a lot dumber than the average person. You think vegas was real? The NYC subway? Buffalo? Uvalde? (Obviously they fucking happened but theyre all glowing more than the fucking sun, especially Vegas, Uvalde, and buffalo)""",n
29359693821,b'Less? Google one way trips from volaris and one way trips back with interjet.  ',y
33796419283,"b""You might want to [Google](https://auto.howstuffworks.com/fuel-efficiency/fuel-consumption/sugar-in-gas-tank.htm) that yourself as it doesn't dissolve in gasoline and would be as helpful as sand.""",y
42172924981,b'Dope man Ill have a cooler with some brew.',n
31980257243,b'Lol I didnt see that one when I searched on google.. is it still open ?',Y
39589988684,"b""I'm literally not\n\nI'm clarifying""",n
27892170960,b'Ompomp is on the right track. Many classes will transfer to a bachelors. There is no need to complete an associates at all as it will not likely even get you an interview for most jobs let alone a hot cup of coffee.\nOf course it all really depends on what you want to do with your degree after you graduate and who you want to work for. The biggest obstacle will be getting that first job.  After you have a few years of experience then your degree will matter less. \nKeep in mind that a CS degree is not a programming training course. You learn tons of stuff about many aspects of computing and have a fundamental understanding of things that will allow you to think outside the box.  You can think of it as the difference between a mechanic and someone that designs cars. Very different jobs with very different pay. \nOf course this is just my two cents and your path is your own. ',N
32712225750,b'Those probably exist somewhere..... I really wonder how they look.... probably horrific\n\n\n\nEdit: Im wrong they are cute. Did a google search',Y
30811252685,"b'I keep seeing this sentiment come up and I don\'t get it. \n\nObviously you guys don\'t compete with Austin for raw numbers of tech companies/employees, but to ignore the amount of talent and opportunity in SA is disingenuous. I don\'t know if people are grouping everything government into a ""government"" category rather than considering the individual areas *within* government, but you have Rackspace, USAA, an FBI field office, NSA Texas, and JBSA (DISA SATX, ARNORTH JOC, 24th USAF, 25th USAF, JIOWC, I could go on forever).\n\nY\'all got tech and talent. Yours just supports Uncle Sam (for the most part) while Austin\'s does not (also for the most part).'",N
33010150582,"b""I am super picky about quality and usually won't go somewhere that isn't 4.5 or better on google or yelp. Heck, the Jim's near my house is close to a 4.0 (which is what Stella's gets on yelp). \n\nPeople were talking about Mexican and there are endless high-quality mexican places around for low prices. Chela's is probably my favorite if we are trying to keep the prices low, Carnitas Lonja another. Heck, I can't stay out of El Trompo and it isn't much money at all, $12 for a lb of Barbacoa!""",Y
40520882100,"b'I have made 4 different accounts now and keep having the exact same issue, even tried my partners phone, my kids tablet, and our MacBook. Thats why I posted here, wondering if it wasnt just me'",Y
34557037992,"b'It is, but there are other problems beyond just those people dying. Health care capacity is the main concern if we just look at it from a statistics point of view and ignore the ""every life is priceless"" argument. The entire premise of flattening the curve was that with the level of infectivity this virus has if it\'s left to run as it would naturally you end up with people dying because the health care system becomes overwhelmed. People that wouldn\'t have died normally are now dying because all the ICU beds are full, because hospitals run out of supplies. Got in a car accident and need to be in the ICU where you would normally recover if you receive that level of care? Sorry, no ICU beds, perhaps you still make it, maybe you don\'t. \n\nYes, it\'s more deadly for people in certain age demographics, and those with certain underlying conditions, but they aren\'t the only ones ending up in the hospital or the ICU. Younger people and those without underlying health conditions do still end up in the hospital and some in the ICU, even some on ventilators. Most survive, though we don\'t know of the long term effects yet. So now if the health care system is overwhelmed and there aren\'t enough beds/resources to care for those non-high risk people who happen to get really sick but normally pull through they start dying as well. Once we lose the ability for everyone who needs that level of care to get it the mortality rate goes up.\n\nThe answer, as usual, will probably be somewhere between the two extremes. Shutting down everything for 18 months isn\'t an option, but on the flip side throwing the doors open is insane. For example, why are bars open at all? They are by their nature a perfect environment for spreading the virus.\n\nTexas is setting record numbers day after day for COVID-19 hospitalizations. Not just positive tests, hospitalizations, if that trend continues like we saw in New York a lot of people are going to die, for what?\n\nThe state has a lot of interesting dashboards around COVID-19. I would recommend taking a look at them, look at the trends based on how people have been behaving the last few weeks(memorial day, busy bars, protests, etc.)\n\n[Texas DSHS Hospitals State Wide Capacity](https://txdshs.maps.arcgis.com/apps/opsdashboard/index.html#/0d8bdf9be927459d9cb11b9eaef6101f)\n\nApologies if that was rambly and repetitive, I\'m getting tired but want to get those posted. Stay safe out there, thank you for doing your part and at least wearing a mask and maintaining social distancing.'",N
37502092106,"b'i know if care.com, is there any other apps u would recommend?'",y
38104952572,"b""Thank you. That worked. We're not people born into the technology generation. And he signed into Facebook finally but his location history was not turned on so there's no way to find the old phone""",Y
39589821629,b'I can kind of see it. The shoulders are a little big',n
39987409896,"b'They go by multiple names, but they are also one of the only places open until 5am, besides some fast food joints. So when people want food late, its one of there only options. \n\nSo they have horrible reviews and the building looks really run down but every time I do a pick up there, they are extremely busy, like cranking out 20 orders at once  slowly of course. \n\nThe woman working there is very beautiful  so  for that reason I dont mind doing the pick ups.'",N
34583893165,"b'dang so is this iPhone, I didnt think to restart the iPhone, because I was live. I think the major contributing factors is that I was using T-Mobile at the time on that device.'",Y
37544107607,"b""Agreed on last statement. Looked at vic's facebook friends they're almost of felons, gangsters and prostitutes. The act is evil of course, but live by the sword... well you know.""",Y
29242951953,"b""Find a buddy or relative (parents that still have service, for instance) and get their cable/satellite login. Then you can just use the official apps/websites for various networks; doesn't cost them anything extra or affect them in any way.\n\nFor everything else, there's Netflix, Hulu, and single-subscription services like HBO NOW, etc. Worst case scenario, you download episodes of some of your favorite shows.\n\nI've been a cord-cutter for 5 years now and haven't missed it once. I can't stand watching cable TV at someone else's house anymore, the commercials drive me insane. I rarely have to download anything anymore either thanks to so many services pushing things online.\n\n~~edit: A fairly useful comment got downvoted?~~""",Y
28842819667,"b""Their Facebook doesn't have it as an event """,Y
41725284149,b'Join the movement. SART - San Antonians for Rail Transit. https://www.facebook.com/groups/2539887962847015',Y
30637126841,"b'Interstate *410* is a loop route of Interstate 10 around *San Antonio*, *Texas. According to google atleast . The signs while i was driving in san also identifird it as i-410* '",N
26371907199,"b""It's on Old Blanco Road south of Bitters behind Martha's restaurant (I think it's still a Martha's but it's been so many things in the past 10 years I can't keep track).\n\n[Here's a map link](http://maps.google.com/?ll=29.564835,-98.520965&amp;spn=0.003484,0.00449&amp;t=h&amp;z=18&amp;layer=c&amp;cbll=29.564755,-98.520926&amp;panoid=sfz2ePotpWX9UVqM-6HFxQ&amp;cbp=12,255.34,,0,9.25)""",Y
33049362041,"b'They did that on everyones phone in L.A. last year or something. At 3:00 am.\n\nJust a screech, then: amber alert! Child abduction!\n\nNothing else. Then everyone disabled amber alerts on their phones.'",Y
30857783903,b'Literally just happen this morning heading west on 1604 from Bulverde Rd entrance. Dumbass lady in her giant SUV talking on her phone pulls right into the highway going slow as hell and straight into the left lane. Traffic was actually moving quite nicely up until she butted in. Super annoying. ',N
28746821835,"b'Jeusus christ dude, chill out.  So its tasteless and some people are offended, you do realize these people are getting death threats over this dumb shit?  Is that a proportionate response?  They should lose their entire lively hood over some idiotic stupid ass commercial they put on facebook?'",N
29582431661,"b""If I can get it to work, which the forums suggest I can,  \n  \nIt'll likely be an HTC 10 (Tmobile)  \n  \nAccording to my reading, they are physically the same phone. But I'll likely need to pay it off or get it unlocked some other way for it to work. I dont owe much on it, probably will just pay it off.""",Y
