parent_id,Body,group2_tech
27968556319,"b""I think arts, culture, and science should be subsidized as it often appears that the free market doesn't grow those areas effectively and authentically.  But considering how cheap modern technology has made some things, such as making movies and tv shows, it may not be as necessary.""",Y
38327218101,b'USAA is a great choice. I worked there for two years. They dont have the most modern or fast paced environment (banking regulations = slow) . Their technology stack is actually better than most other banks and the people who work there are pretty smart cookies. One of my former coworker could easily have worked at Google. The pay is subpar but for a first job its 11/10 when it comes to benefits and culture. Your manager cares about you and your coworkers always want you to grow.',Y
31499873480,b'Apparently Reddit is Facebook now...',Y
26337146564,"b""Yeah I have two but they're both classes that can both be done at home. Computer Business (mandatory class) and an art one. Guess I get to work on that project though. So no worries. """,N
27941958726,"b""His post is caught in the spam filter, but you can see it from his [profile page](/u/SAUrbanFarming). Here is what it says:\n\n&gt;I first learned of hydroponics while in high school, for an experiment. I grew 2 sets of tomatoes and lettuce one hydroponically and another in soil. The set grown hydroponically outperformed the set grown in soil in both size and overall yield. That was several years ago. Since then I have designed and built my own hydroponic systems, I'm by no means an 'expert' but I do have experience growing tomatoes, cucumbers, lettuce and other produce with great results, using my systems. A few examples here: www.facebook.com/saurbanfarming""",Y
26747931746,"b""I feel like a reckless driver sometimes personally.  The truth is I'm just trying to almost go the speed limit, not 20 to 30 miles under.  I generally count how many people I see talking on the phone and not paying attention (going 20-30 under the speed limit).  It is about 1 in 4.  Its hard to tell sometimes because I'm trying to watch the road, but most times it is blatantly obvious because of their driving habit.""",N
35371900875,"b'Ooh, I was asking a rhetorical question but I appreciate the work you put in to calculate the numbers!  My point is that a simple case count does not account for the improvement in technology and science regarding the evolving survivability rate for contracting the virus.'",Y
34176887007,b'Damn 74$ ? Google fiber is better I think',Y
27187328521,"b""&gt;  you'll be spotted by folks you know, as there's not much anonymity here (i.e., everyone seems to know everyone)\n\nI'd bet money we either have a few mutual friends on facebook or already know each other.  And if not...WHY NOT? You sound cool! """,Y
34633048947,"b""&gt; hiking in the open air in one of our parks.\n\nI'm going to make the rash assumption that you are new(ish) to SA and don't realize what happens in SA parks on holidays.\n\nhttps://www.youtube.com/watch?v=cLm8dukRJk4\n\nThere's no hiking, per se. It's more of a huge drunken party.  All the local parks, but mainly Breckenridge lately, become a mass of extended families pitching tents and CAMPING in the city park for the duration of the holiday, trashing the place and not picking up after themselves, which takes the city workers 2 days of cleanup.\n\nGoogle 'San Antonio Easter park camping' for pics showing thousands of people camping 5 feet from each other.  \n\nThat's the reason the parks are closed, because people can't behave and follow social distancing guidelines.   \n\nThe parks will be open again after the holiday weekend. \n\nBe safe.""",Y
28210087361,"b""I'll tell you why... Google says permanently closed. I didn't get an answer when calling.  But I heard people saying they've seen people walking in and out. Does that make sense to you?""",Y
31001299416,b'Would you mind filling out the following as you are in possession of the lost pet? https://www.pawboost.com/post-facebook-lost-and-found-pets?utm\\_source=fb&amp;utm\\_campaign=fb\\_san\\_antonio\\_tx',Y
35951744307,b'Is there any way that you can tell me what it means when Alorica says they only pay you for phone calls?',N
33353351128,"b'Thats why I say the chart is misleading, the chart takes into consideration the population of the whole county yet most of the murders happen in city limits. Im not sure why you mention the 5 sec Google search when thats clearly where Im getting my info lol'",Y
27247081377,"b""&gt; I don't know of any good rock bands in SA. :-(\n\nCheck out Celebrity Sex Scandal ([Here's their FB page](https://www.facebook.com/pages/Celebrity-Sex-Scandal/254801817882852)).  The lead singer teaches High School Chemistry and Physics, but he used to open for System of a Down with a band called Dog Fashion Disco.""",Y
35078882028,"b""LOL, so angry. No wonder libs are the most miserable people on Earth. I didn't Google for that article it showed up in my FB feed almost instantly after my earlier comments. You know all this anger is bad for your cortisol levels and thus lowers your immunity. Good luck.""",Y
31505482280,"b""Here's one article on it. https://www.google.com/amp/s/www.esquire.com/lifestyle/sex/news/amp41698/match-singles-in-america-study/""",Y
40544082776,"b""Also here's another post with people saying fiber has been installed recently:\n\n[https://www.reddit.com/r/sanantonio/comments/wpsdn4/i\\_just\\_got\\_google\\_fiber\\_2gbs\\_a\\_couple\\_days\\_ago/](https://www.reddit.com/r/sanantonio/comments/wpsdn4/i_just_got_google_fiber_2gbs_a_couple_days_ago/)""",Y
39463087823,"b'adding typing to my resume is not a bad idea, i will take that, and i am still in highschool, if i dont find a job before i graduate that can carry me through college, im most definitely scooping up a computer lab job at vista lol'",N
37804335651,"b""good luck! and yup my older company was only paying me like 38k, and then i found another company that is now paying 60k for half the work lol. but i just interviewed with google last wednesday and ill hear back by next week. although that wouldnt be remote, and i'd actually have to relocate... it beats living in texas lol""",Y
29288745780,"b""Each of Google Fiber's old huts could service about 40,000 residents. With 40 huts that was 1.6 million properties. With 17 huts that was 680,000. Now that its less than that, it's not clear how many residents will have service. The company claims it re-engineered those to service more (undisclosed number) of households but declines to describe how that is possible or other methods that might be used. It's unclear whether Google Fiber's coverage will eventually be the same scope the company initially promised. This has been an issue in other markets where Google Fiber touted a city-wide network but the final plans were more select.""",Y
29416708380,b'Worth a phone call at least. Thanks.',N
28304269344,"b'Im sorry you are getting downvoted. I thought your lame computer jokes were great. Also, booty blasted.'",N
30902074680,"b""I paid $11 (promotional offer was supposed to be $11 for the entire month. I received the fri, sat, and sun paper like I was supposed to but then I saw that my credit card was charged another $10. I saw this late and night and did a little research on them. I found so many stories like what you described, on Yelp, so I called them the next day to cancel service and request a refund on the $10 I was charged. I didn't even ask for a refund on the $11. So I wait a week, still no credit for the mystery $10 charge that I didnt approve. And I wasn't about to play phone tag with this joke of a business so I just disputed both of the charges with my credit card. It's really disappointing, I usually read reviews before I buy things. But I didn't think I would need to do that for my local newspaper.""",N
27386598959,"b""I'm a huge foodie, so that's no fun. What kind of options for vegetarians/vegans? My partner has dietary restrictions. and I come from smaller (but not small) towns like Sacramento and Wellington, New Zealand.\n\nSad to hear about the internet too. Cmon Google fiber!""",Y
27498473875,"b""This isn't true at all. Although there aren't many tech oriented companies in San Antonio, there are tons of corporations that all have IT departments. Not to mention the contractor positions available at the bases. """,N
40262161411,b'I spoke with him the first week after I moved to SA in the central market sushi section. \n\nI had no idea who he was but we were just chatting about sushi. \n\nI relayed this story to my husband later that day about this guy and he pulled up DR pic on Google and asked if it was him. \n\nSuper nice man.',Y
30165728265,"b""You called a cop? Like on the phone? Because last I checked cops don't answer the phones, dispatchers do. """,N
34992377725,"b""I don't mind the comments because they don't apply to me. I'm trying to avoid them from getting picked up. There's only 3 left And as you can see they  Clean up nicely. I posted on other apps also. They're so cute and playful but I know their suffering in this heat and plus they have all these    Fleas and ticks biting  Them.""",N
31824369069,"b'It\'s typically going to depend on the river on any given day where/how it\'s flowing.  The tube companies will generally know where to put you in based on how long you want to float.  I typically go to Rockin\' R myself, often at River Road Icehouse instead of their flagship spot in Gruene, but only because I don\'t like the crowded lines of people around me.  You have to wait just as long because you typically need an extra ride, but that\'s just me.  There\'s several outfitters though.  There\'s also a Facebook page called ""Tubing the Guadalupe River"" that has pretty good, up to date information on flow, etc. and I\'m sure you can ask folks their opinions on tube outfitters they like.'",Y
36261214219,"b""Right all the republicans arent complaining. This is totally the truth because this guy said so. Let's blame reddit too. Everyone on Twitter and Facebook is super happy.""",Y
30934870483,"b'Well, fuck people who do that do dogs.\n\nDogs should NEVER be allowed to roam, I\'ve been chased down by dogs allowed to roam... if not on a bicycle I would have been mauled many times over by now.\n\nA cat is not going to attack an toddler playing in his yard.\n\nCats always flee at the sight of strange humans, dogs are far more unpredictable.\n\nA cat is very different from a dog and San Antonio has a HUGE problem with that distinction, people thinking its okay to let their dogs roam.\n\nThen again the people of San Antonio voted to build a stupid stadium instead of a rail system to connect us to Austin.\n\nOne of the many reasons I cannot wait to leave San Antonio... it\'s a shit city filled with even shittier people.\n\nNot all of them of course, there are thoughtful people here in this city... but too few, the rest of San Antonians keep voting to be willingly exploited time and time again.\n\nI mean Bexar has the highest rate of accidental car accidents caused by idiots on their phones... the sollution?  The county spent waaay to much to develop an app that sends alerts to your phone to not be on your phone... yeah, let that one sink in.\n\nSan Antonio has a ""growing"" tech center while also closing schools.\n\nSan Antonio is building expensive condos and expensive high rise apartments that San Antonians cannot afford, now you have entire high rises completely vacant.\n\nSan Antonio is on the fast track to being the next Detroit.\n\nSan Antonio is a poor city that hates poor people.\n'",N
40351048104,b'I have cricket and at that interchange my phone is basically worthless. If I drive through there while on the phone it will drop the call. If I need to use my map through there it will not load.',N
29315606602,"b""&gt;I'm working for Amazon doing deliveries, making more than most people want to pay for a computer technician.\n\nNot sure what you are trying to say.  That you were previously a computer technician that now works for Amazon or that Amazon pays more than a computer technician.""",Y
38241060032,b'Att fiber is already here.  In fact they were in this area about 3 years ahead of Google. \n\nThey started trenching within a month of Google announcing they were coming to San Antonio.',Y
34711283045,b'https://www.google.com/amp/s/www.texastribune.org/2020/03/04/robert-morrow-showing-state-education-board-race-terrifies-gop/amp/',Y
30383514110,"b""This is actually going to have to be a requirement eventually. Technology WILL advance to the point where we live in a techno-utopia. Nobody will NEED to work. While that day is a long way off, it IS a viable future. Once everything is automated, money will kinda be useless. It'll never happen in our time, but it's likely. And government assistance WILL need to happen because of the aforementioned problem of being unable to be employed.""",Y
28512715914,b'Welcome to SA reddit. This is why we are all in the facebook group \n\n/u/sk33t  You built this shit hole with /u/excoriator',Y
28656867183,b'google.com',Y
41392101088,b'Its so annoying to stand behind someone with 0 people watching their Facebook Live.',Y
37054504813,"b'Don\'t believe google.\n\n""Open by appointment - now scheduling new shows ! Feel free to send us a proposal !\' flight\'s insta page'",Y
36504449988,"b'Is there somewhere there is a high quality uncompressed version of this?\n\nIm on my phone, sorry'",Y
27994144882,b'Found it in Facebook!',Y
31125320167,"b'Then why are we falling behind Phoenix for the past decade? Its one of the fastest growing metropolitans and has started to redefine itself as a tech hub. All this without Sheryl. In fact, we have gone backwards in regards to technology. We are only getting fiber built out in the city while other cities are surpassing us. I love San Antonio but you have turned the Firemans Union into a boogeyman and scapegoat for all the cities woes. Maybe new blood will reinvigorate the city managers office. '",Y
40626116454,"b'And ordinance comes from something same as street maintenance and bond projects. Whatever the mechanism was that triggered this proposed ordinance know that someone followed the process, calling 311 or submitting a change to the [unified development code](https://www.sanantonio.gov/DSD/Resources/Codes#154541587-udc-updates). Anyone can do it. If you really have a bone to pick then pick up the phone and tell your council person to vote against this proposed ordinance'",N
26790222739,"b""It's 2013, we aren't all sitting in front of a computer. Also its stupid and pointless.""",Y
31125424094,"b'The city manager can only act within the constraints set by the city council, the city charter, and state law. How the city manager navigates those constraints while making city government as effective as possible is no small feat. Sheryl Sculley has shown that shes been able to do this quite well.\n\nBut its extremely important to keep in mind that the city manager, by design, does not set policy. Policies such as city ordinances and the budget are set by city council. If you dont like the policies in place, then every two years you have a chance to vote for someone who will change them.\n\nMunicipal fiber may not be allowed by state law (many states have effectively banned it and Im not certain if Texas is one of them), and even if it is, thats something city council has to do decide to do and city residents will also need to accept a tax increase for that. For the private sector, Google Fiber hit quite a lot of neighborhood opposition to the infrastructure they needed to install to run a fiber network and Google consequently curtailed their deployment. City council did not act to try to better balance the needs for high-tech infrastructure with the interests of neighborhoods so the city tossed away that opportunity. The city council gets elected every two years so this is a reflection of the will of the voters.\n\nChris Steele and the fire union are not bogeymen or scapegoats for all the citys woes. They do bear responsibility for actively harming the interests of city residents in the pursuit of their own narrow interests for some recent issues. They are manipulating populist sentiment in ways that harm the citys long-term prospects just for some short-term gains for themselves. They want the city to be saddled with unsustainable healthcare and retirement costs which benefit people who are already retired, or will be soon, without any regard to the fact that future firefighter retirees will likely get screwed. Look at Houston and Dallas for examples of what happens when cities negotiate overly-generous pension benefits for public safety workers that turned out to be unrealistic (both of those cities public safety pension funds essentially went bust).\n\nAt least San Antonio has a city manager that identified that its irresponsible to negotiate generous benefit packages with public safety unions without regard to the long-term cost. She dared to suggest slowly reigning in those costs in ways that would have as little impact on public safety employees as possible while balancing the fiscal needs of the city and the residents who fund it. Too bad that made her a target for the union and its the residents of San Antonio who will bear the consequences. Shell get a nice, well-deserved retirement while the city and its residents will face the costs of what it voted for.\n\nPhoenix residents voted for policies, including increased taxes on themselves, and elected leaders that would start to steer the city away from merely being a destination for retirees and those seeking cheap housing where at least its a dry heat. Similarly, its up to San Antonio residents to make this city a better place to live for themselves when they go to the ballot box.'",Y
26871985409,"b'Worse comes to worse, kgb is hiring for tech support and they have work at home available...'",Y
41511198049,b'Yeah. I REALLY wish it wasnt the case. Unfortunately its another case of the government being wayyy behind on technology. The legal process requires physical signatures for a ballot initiative.',Y
27642899650,"b""I saw an article a little while back saying that Uber is shifting their negotiation strategy and will be respecting C&amp;D letters issued by cities. Apparently this bully tactic isn't getting them everything they want. \n\nAlso. I found [this](http://www.columbiamissourian.com/a/185255/uber-says-it-will-comply-with-columbias-new-ride-sharing-regulations/) article where Uber has agreed to abide by rules in Columbus which are far more strict than ours. \n\nReally though. When you do a search for Uber cease and desist, you get a huge list of cities fighting Uber. What that tells me is that all this fear that tech companies or young people wanting to move here will see our city as backwards is just bullshit from the Uber lobby. Nobody gives a shit, and every city is fighting with Uber or already got Uber to agree to regulations that are probably stronger than ours. \n\n""",Y
27978425165,b'google is so frustrating sometimes. ',Y
41312511965,b'I had the exact opposite experience and switched to Spectrums gig. Google was out constantly and it was infuriating. N/NW side. ',Y
29822180281,"b""Or the 5,000 strip malls, Walmarts, storage places, gas stations, outpatient clinics, empty office spaces and electronic billboards that they keep cutting down trees to build. I'll take a Google hit over another fucking useless strip mall where half the space is empty any day.""",Y
41950399441,"b""Tech Port SA has SAMSAT, with very cool lego builds too. They're supposed to have a maker space. Can probably do gatherings there.""",Y
27822627197,b'https://www.facebook.com/SaManUnitedCrew\n\nLocal Manchester United crew',Y
37361879321,"b'Bingo. My dad said some roofers were scouting our homes from the roof tops and I told him he was being hyper-vigilante but it seems he was partly right! Our nextdoor app is always buzzing.\n\nBeyond thatSA can become extremely unsafe if youre unaware of your surroundings, whether that be the area youre in or just distracted on your phone. Follow your gut. Like always. And you should be good '",N
27200513923,b'got a link for the facebook group? ',Y
34243010818,"b""[No it's not. The face covering isn't about stopping airborne particles. I never claimed it will stop all instenses of the virus getting expelled. That's what N95 masks are for.] (https://www.google.com/url?sa=t&amp;source=web&amp;rct=j&amp;url=https://www.cdc.gov/coronavirus/2019-ncov/downloads/cloth-face-coverings-information.pdf&amp;ved=2ahUKEwi92cXN7qzpAhUHZKwKHTHfCEsQFnoECAMQAA&amp;usg=AOvVaw2GA39vQ2Nz74qzAIwFBJcL)\nDown vote all you want. But go to that CDC pdf and see I'm right.""",Y
38280151599,"b'Lol! Well honestly everyone knows how they stay open through the toughest times  You can see the rest of the images of the cake I made to find the ""Easter Egg"" lol! \nhttps://m.facebook.com/story.php?story_fbid=2976115875983882&amp;id=100007564966770&amp;sfnsn=mo'",Y
35065151147,"b'&gt;Outside of being in a similar colored shirt and he was originally described as having basketball shorts with no specific color.  And he was a black male as was told to them by the victim, on foot in  the area. **You act like they just stopped him for no fucking reason at  all.**\n\nThat\'s a lie. He matched an initial description and that\'s fair. Ometu is right to be upset because he doesn\'t know what\'s going and probably doesn\'t want any involvement.\n\nIf you watched the video that\'s *available on this sub* you\'d hear that the police later get a correct description which Ometu does not match and they proceed to attempt to move Ometu to the victim\'s location...\n\n&gt;If you gave a shit about the womans safety, you wouldnt be cheering on  a total piece of shit that wasted the cops time when HE FUCKING HEARD  HER on the phone with the cop trying to figure out if he was the  boyfriend or not.\n\nYou need to watch the video and watch the part where the police officer gets a clear description FROM THE VICTIM that clears Ometu of any involvement with her.\n\nThen proceed to watch how the cop elects to ignore this CORRECT description.\n\n&amp;#x200B;\n\nHere you go: [https://youtu.be/O79AmjbLMyU?t=1500](https://youtu.be/O79AmjbLMyU?t=1500)\n\n&amp;#x200B;\n\n""How short is his beard? It\'s real short?""\n\n&amp;#x200B;\n\n...\n\n&amp;#x200B;\n\nCop with bodycam lied to officer with the victim about Ometu\'s beard.... And then kept working like he didn\'t just get a huge revelation on who they were supposed to be looking for.\n\nYou can\'t defend that shit.\n\n&amp;#x200B;\n\n&amp;#x200B;\n\n&amp;#x200B;\n\n...Yeah, no, fire that officer or suspend without pay for a long ass time.'",Y
37777198110,"b'Its at the fiesta texas parking lot. It is an A+ meet, all kinds of cars, coffee, food, dogs. Look up cars and coffee san antonio on facebook'",Y
34741249170,"b'At the moment, it looks like NEISD is trying to do a live learning schedule, so the students day is already scheduled out from 8-3 (30 minute lunch, 15 minute recess). If I had the choice, we would work much more flexibly so that we make progress, but can do it in a fun way. Ideally Id love to be able to follow something similar to a Montessori method where students learn through experience and can focus on subjects that interest them during enrichment time. \n\nI also know how important it is for kids to be able to move around while they learn, and not just sit in front of a computer. Id like to be able to make the assignments as fun as possible. More than likely during asynchronous learning time I will take the assignments and adapt them to be more interactive, even if its as simple as doing math problems on a small white board with a dry erase marker. I also have a big back yard so I plan on getting some backyard toys (soccer ball and goals, football, sidewalk chalk, etc) \n\nI also have a lot of websites in my back pocket with educational content- vocab games, math games, typing games, storyboard makers, etc.'",N
34271608597,"b""Anecdotal evidence of people piled into a car with nice phones: is the car a gift or salvage title? Did they get their phones from GameStop or a pawn shop? Are they using SIP or VoIP phone where they need wireless internet all to use their phones? Like in most cases you can't even get a job without a permanent address, and all y'all love to judge like there isn't away to buy a nice phone without putting your first born up for collateral.""",N
27352207166,"b'That would be an example of a frivolous petition, most of those fail.\n\nA petition is a representation of the petitioner\'s desires to enact change and, when the petitioners actually commit to the topic changes do occur.\n\n&gt; I could start a petition on there to have Wendy\'s dye that hair blonde and it could get 100k signatures\n\nGo for it, get your 100k signatures and maybe she will actually get the dye job done; politicians wear those stupid lapel pins because of ""popular opinion"" maybe your movement will have a similar effect.  Just make sure they\'re 100k real individuals, the power of a petition stems from actual people committed to it.  ""Edward Lowark from 1216 Teresca Street*"" signing a petition has a lot more weight than ""throwawaydafunk"" signing it.\n\nBut hey, if you\'d rather do nothing when something bothers you then go ahead, its within your rights to do so but it\'s also within our rights to try.\n\n*[Address is completely fictional according to google maps](https://www.google.com/maps/search/1216+Teresca+Street/@29.5699629,-98.6091102,13z/data=!3m1!4b1).'",Y
37628359761,b'https://www.facebook.com/100036607688599/videos/553635095834527/?refid=18&amp;__tn__=R',Y
