parent_id,Body,group2_tech
26518689074,"b'No, I am not saying that, and I have no idea what you are smoking to come up with that.\n\nStudents do in fact have an expectation of privacy at school. Just because they are children doesn\'t mean the Constitution doesn\'t apply to them. Halls are public areas, but a student in the bathroom or alone in a classroom has an expectation of privacy. And you seem to be forgetting that this technology doesn\'t magically stop working once a student leave the campus.\n\nBut as for your ""if you are innocent you have nothing to hide"" that is the most dangerous mindset an American can have. Is your wife or daughter doing anything illegal in her bedroom or bathroom? No? Then you wouldn\'t mind if I installed cameras there, good citizen? And you claim you aren\'t doing anything illegal? Did you exceed the speed limit by 1 MPH today? Did you wait exactly 3 seconds at every stop light? Did you wander 1 inch out of your lane? Did you forget to signal somewhere? Break some minor statute you\'ve never heard of? We have the technology to mail you a ticket dozens of times a day for every minuscule infraction you ever make, we could build a perfect police state/nanny state, but it won\'t be possible without hoards of Americans claiming ""if you are innocent you have nothing to hide.""'",Y
27733070797,"b'We are now friends with Joan Cheever on facebook and should know more about Tuesday night soon.\n\nIn the meantime, these links provide good background about Chow Train and her work feeding the homeless:\n\nhttp://www.thechowtrain.com/about-us.html\n\nhttp://www.rachaelrayshow.com/celebs/19071_a_woman_using_her_food_truck_to_fight_hunger/\n\nAfter reading her bio, it is hard not to conclude SAPD picked on the wrong chef.\n\nHere is the Chow Train donation fund for their legal expenses: http://www.gofundme.com/chowtraindonation'",Y
41518445781,"b'Not yet, but if she does Ill know right away with my fast and reliable internet service from Google!  Im not selling anything, Im just letting you know that I get great service at a good price. All my neighbors love Google fiber internet and so would you. All the cool kids get Google.'",Y
36354954144,b'These 2 apps plus Reddit helped me meet amazing locals during this pandemic.',Y
34600335614,"b'It may because you dont have the service enabled in Notifications on your phone. Its under Government Alerts, with Amber Alerts, etc.'",N
30518125187,b'This place definitely looks like what Im looking for after taking a look on Google Maps. Unfortunately its about 25 minutes from me but Im going to remember this place if other recommendations fall through. Thanks for the help.',Y
36742182175,"b""off a quick google search - both the government student loan program and the DOE's Energy Loan Program have turned a profit.\n\nmost medical care programs end up turning a profit, but it's in more long-term, encompassing patterns rather than an end of quarter ledger""",Y
27953712706,b'Facebook page or website? Might drop by',Y
33973137617,"b""It's only 200/20 - given that Google Fiber would give me bidirectional gigabit for that same price, I feel I'm overpaying a little.""",Y
38813128638,b'If you google Area 51 food park itll tell the hours on the right.',Y
29822394593,b'Eli the Computer Guy did a pretty good response to this question in my opinion. https://www.youtube.com/watch?v=D6cUMZbx6GI',Y
34098177519,"b'There are no public signs asking for this requirement, plus some dont have technology or TV how does it feel to be privileged? Also what about the poor who cant afford the masks?'",Y
28707628159,"b""You owe it to yourself to try it.  Google the nearest location, go there for lunch and eat the massive nachos plate (if you like nachos, but who doesn't).  I used to work off Perrin Beitel road near the Chachos and would eat there periodically along with Bill Miller's, Taco Cabana, Whataburger and Dairy Queen.  All of those contribute to San Antonio's distinct flavor, in my opinion.  None are world class restaurants but if you eat fast food, you might as well try all of those because they're no worse than any average fast food place.""",Y
26671034517,"b""If you call hacking it being susceptible to brainwashing, then sure. It's seriously a company stuck in the 60s in terms of management, and 80s in terms of technology. If you're the kind of person that can agree that the sky is green because your boss said so, then it is the perfect company for you. I couldn't.""",Y
39021142658,"b'Same except mine is just plain old. I could do DND the bypass setting on iPhone, but I dont trust it since it various features mess up sometimes on my phone.'",Y
35615725589,"b""Thanks for this. The site doesn't seem to be well optimised for mobile, or it's just my shitty phone, either way, the site is largely innavigable for me. So bear with me. \n  \nFrom what I *can* see, it looks to me that testing has increased substantially by about 10,000 with about 50% more negative or inconclusive tests and 40% fewer positive tests between the peaks shown from the available dates in July to Nov 15.  \n  \nWouldn't that suggest exactly what I was saying, that the increases we are seeing lately are largely due to increased testing, not increased infections?  \n  \nI understand that we're having increases over the relative dip we've had throughout the past couple of months, but it doesn't look to be on the same level as what we saw in July and August. So again, it seems like my question was on point.""",N
27462514702,"b'Holy shit. You really are an idiot. Let me break this down for you. I\'ll try to use small words you can understand.\n\n&gt; It was never an arguement on semantics. I don\'t see shitty chain restaurants as taco stands. You obviously have a different definition of taco stand.\n\nThat\'s literally what arguing semantics is. You tried to argue the definition of ""taco stand"" because nothing else you said held water.\n\n&gt; I\'m from the south side... blah blah blah\n\nNo one gives a shit about your life story.\n\n&gt; Then you said it was a shitty chain. Okay? I ddnt bring that up either. \n\nReading comprehension is important. I know you wanted to smash out a response as fast as you could, but you should actually read what I wrote. I said it looks like a chain restaurant and gave an example of a chain restaurant. It was seriously like 1 sentence. Could you not be bothered to read it before you started making shit up?\n\n&gt; You compared it to Firewok. What the hell kinda taco stand doesn\'t sell tacos? \n\nThis right here is gold. It gets right to the point: you didn\'t read anything I wrote before you made a fool of yourself. \n\n&gt; I told you my definition of a tacot and an you\'ve still not defined yours.\n\nYour definition of a taco stand is a food truck. If you think that is the only place Mexican street food comes from then you don\'t know anything about tacos. I even asked you to google taco stands to see if people use the term to refer to restaurants. Obviously you didn\'t do this or you would realize that your narrow definition of taco stand isn\'t the same as everyone else\'s definition.\n\n&gt; Googling ""San Antonio taco stand"" gives me a list of mom and pop places that people usually praise. \n\nOh shit. You did do it. And you found that people don\'t just mean ""food truck"" when they say taco stand. Will you learn from this?\n\n&gt; So, even following squirrelly patter sheds no light of your idea of a taco stand.\n\nI guess not. Aggressive ignorance here.\n\n&gt; I wanna say I\'m sorry for name-calling but your agressive attitude makesh at very difficult.\n\nI forgive you for acting like a child, but not for acting so dumb. No need to blame me for your shortcomings.\n\n&gt; I\'m giving you the benfit of not reading outside what you\'re saying\n\nYou aren\'t even reading what I am saying.\n\n&gt; I meant what I said. Not what you think I meant.\n\nI know what you said. The problem is that it is wrong and you tried to argue the definition of ""taco stand"" rather than to just admit you were acting like a jerk in the first place.\n'",Y
28378389507,"b""yeah.. the CC needs a phone/tablet.. but that typically isn't a big deal for me. My biggest issue is that I want to be able to see a Spurs game without having to mount a cable / satellite box outside.\n\n""",Y
36522739389,"b""Ive seen about four cases of i influenza over the last 5 months, compared to about 70 cases in 2019. Something clearly happened to drastically curtail those numbers. Im genuinely curious to know where YOU think the flu went.\n\nAlso Im glad your mother has avoided getting sick, but over half a million dead people haven't been so lucky and of the survivors, hundreds of thousands live with chronic heart and lung impairment, reduced renal function, and strokes due to the damage the virus causes. I have former athletes that cant do their laundry without getting winded almost a year since the contracted the virus. My advice to you and people like you is this: health experts arent overreacting, the scientists and professionals are right about the seriousness of this disease. Masks protect you and others, despite what you read on facebook or in articles about misinterpreted CDC reports.""",Y
27327353957,"b""I can't link it from my phone, but check the side panel in this sub, and there should be a link.\nOtherwise just search 'San Antonio Reddit' on your Facebook. \n\n\n\n\n\n\n\n\n\n\n\n\n\n\n\n\n\n\n\n\n\n\n""",Y
34444715222,b'I know still pretty bad. But it is worth to see that the closest nations to the US in terms of technology and government type can do it better than over here.',Y
30566020647,b'Okay sorry. Its another bill for an already tight budget. Additionally you can see them peddling  cable and the phone adds on the . Do you think the spectrum new account rep will not try to offer these additional services ? I bet a fully loaded spectrum low income package can get up to $100 or more. ',Y
26806230978,"b""Tech Antonio?\n\nI wish we had a good nickname but I still haven't thought of one.\n\nASATech is one I've heard around - Austin/San Antonio Tech""",Y
31306756419,"b'Ah great, a link to a two hour video. May as well just link to google.com'",Y
26921230581,"b'Rackspace, USAA, and government contracting does not a diversity of opportunities make. Amazon, as near as I can tell, doesn\'t do significant dev work here. Which shouldn\'t surprise anyone, as the nearest good CS college is in *Atlanta* and the young urban professionals that Amazon often hires don\'t typically go head over heels for SA.\n\nI\'m not having trouble. I\'m actually doing quite well. I\'m just disgusted by the handful of companies that is routinely passed off as a thriving and vibrant tech sector. The number of actual tech companies here - aside from my friends at Geekdom - is shockingly small. When the second-largest technical employer is a *bank*, you got issues.\n\nA dozen companies that hire software people does not qualify as a major software industry.\n\n&gt; Your amazon purchases normally shouldn\'t be 30-40% of your monthly paycheck.\n\nYou missed my point entirely. My point was that many goods, services, and expenses are *not* adjusted for local cost of living. This is not something to be dismissed out of hand. One of my coworkers is being hit extremely hard by that. I\'m sure he\'ll be pleased to know that the cheap rent makes everything OK.\n\n&gt; 50k a yr in SA is probably worth about 55-60k in Austin where you pay 3-400$ more a month for an apartment or mortgage, among other things.\n\nAnd you might be able to get away without a car, rendering that $300-$400 a month a wash.\n\nA bit of advice: ""it\'s cheaper"" doesn\'t make up for ""there\'s one tech company of note"".'",N
30999005371,"b""Does anyone have a google search URL by which OP could find the Cove's phone number? Maybe I'll just start a new thread for that question!""",Y
32372437227,"b'But, don\'t you think it\'s kinda sad when you have all the relevant qualifications and still stuck on t1 support? Like I got a masters, certs, and a couple of years of exp, and can\'t even get an interview for a ""service desk"". When I think ""tech"" call center is not it. That\'s more of a ""service"" job not tech job.'",Y
28102241452,"b'Yes.  These auto parts places will indeed scan your obd2 compliant vehicle.  They will then print out the codes meaning and try to somewhat explain what is happened.  For more info, search google for the code and your particular vehicle.  You just may find a walk-thru on how to do the repair yourself.\n\n'",Y
38334688410,b'Hmm I keep getting told its 70 in my area. I have spectrum and its 35 and has been that way since I moved in 2.5 years ago so I havent switched. \nBut Wi-Fi on my phone/laptop/iPad is useless sometimes. Streaming on my tvs is fine though',Y
33741711092,b'Yup! iPhone X still',Y
31779440743,"b""I'm excited for Google Fiber. Especially since SA is getting it before DFW""",Y
27922651089,"b""Me too.  I had some problems when Comcast was trying to acquire them, but once that was called off it went back to what it was.  Their CS has always been good.  I'm sure they have their problems and until recently their pricing/speeds were not up to what they really should be, but that's what this whole Google thing is about; spurring competition.""",Y
36544071660,"b""Interesting, don't have internet at this house yet and don't want to get into a contract if Google fiber is coming, but moving soon. Wish they provided some info""",Y
28643535438,"b""Someone just said the same shit above me and named their source. It's trump himself. A quick Google will find you him saying and doing these things in context and Google the word fascism while you're at it. People like you use source as a defense, but it's not like facts mean shit to Trump drones. """,Y
32750038328,"b""Why?  This post sucks.  It's completely uninteresting Facebook material.""",Y
36466371445,"b""I believe you can withhold rent to pay for issues your landlord refuses to fix. I'd google it.""",Y
32592310921,b'I was lucky enough to be able to capture this image with my phone. I have the Samsung Galaxy 9',Y
40004090770,"b'Statements like that are misleading, so in terms of Mwh, yes we may have lost 5x more than wind, but that\'s because wind only accounted for a drastically smaller percentage of our total production.   If you look at the loss as percentage based on normal production,  gas was far more reliable during the storm and contributed significantly more power to the grid.    There\'s a chart here showing the day-by-day production.    \n\n\n[https://www.dallasfed.org/research/economics/2021/0415.aspx](https://www.dallasfed.org/research/economics/2021/0415.aspx)  \n\n\nI didn\'t blame solar and wind, I said their failure\'s didn\'t help.   Do you take ""didn\'t help"" as me saying it was the sole cause?   This is where I don\'t understand your comprehension.   Both me and my parents solar were buried, I saw them buried.    \n\n\nI don\'t have any issue with renewable energy, I wouldn\'t have spent $25k on a solar system for my house if I did.   I don\'t even have a problem transitioning towards renewable, I have a problem rushing the transition to them to where events like the snowpocalypse are common occurrences.      Once battery technology has improved we\'ll be closer to making that transition on a larger scale.'",Y
29023955235,"b'I think Google likes hooking up apartments due to the high density or residents. There is a lot less ""last mile"" fiber to run when you are running it for that many people in a small area. '",Y
38508045410,"b""I used to have neighbors (Hispanic). Big trucks were cleaned daily. I fixed their computer once. The power supply died because the roach shorted the high voltage line. When I went into their house to diagnose the computer, I was shocked. The house was dirty, horrible furniture, but the large flat screen tv, which was stolen by their kid's friend later that year. People need to set their priorities right....""",N
39832135769,"b'I\'m a dumpster fire and you can\'t Google ""Dumplings in my area"".'",Y
38324857241,"b'Yes, but OP was asking about Computer Science specifically. The students who founded Rackspace were more business/entrepreneur spirited.'",N
40222254038,"b'Yeah, by Elon Musk and his fanbase.  I think the city voted to ""research the possibility"", which hopefully means they google ""how to build trains, but worse"", saw this idea as the first result, and dismissed it.'",Y
30780310911,b'I guess that was someone else who sent me the link sorry but I appreciate the link to google.',Y
35655042266,"b""Guess I missed this comment.. Just gonna say I don't know what OAN is, I actually had never seen Newsmax until it popped up on youtube yesterday and I haven't been on Facebook in years. So your point is?""",Y
29284450586,"b""You part of the Facebook group? There are people who like running and hiking. Now that it's getting warm people are starting to go out more.""",Y
27452499832,"b'Papa Jim\'s is a cool spot, but there are a bunch of places you can go, some of which may be closer. Look up ""botanica"" on Google.'",Y
31977600222,"b""I'd have never thought it was legal.  Lol.  Too bad there isn't a website other than facebook to find those deals.""",Y
34763730902,b'Do you mean [cormorants?](https://www.google.com/search?q=double-crested+cormorant&amp;sxsrf=ALeKk00rrazCBmoHjiSGUFdYsCN5-iS_NQ:1595468168451&amp;tbm=isch&amp;source=iu&amp;ictx=1&amp;fir=V9EqxtLaOS2X4M%252Cnlk_6v4HAGBe1M%252C%252Fm%252F01fj0k&amp;vet=1&amp;usg=AI4_-kQzlRoqSej1Zve4oe-M0czcKtwqgw&amp;sa=X&amp;ved=2ahUKEwjo8riLnuLqAhUNTKwKHRzmDccQ_B0wHnoECBYQAw&amp;biw=1360&amp;bih=695)',Y
27181212247,"b""Go to the google fiber website. It'll ask for your address and email. """,Y
41584887510,"b""There's an app, DM me!""",Y
30071502130,"b""I'm afraid to google, what is it?""",Y
29963611675,"b""Thats very interesting that they tried to make you pay, I dont think they've ever mentioned anything about paying for a tech visit aside from the 'install fee' which I've always avoided by picking up equipment/dropping off equipment at the TWC store in park north.""",N
28011962983,"b""I live in this apartment complex. And I definitely wouldn't recommend it. In the six months I've lived here, we've had a break-in on a Sunday during the day when we weren't home, a shooting that happened a couple of buildings away with no details that I know of on it. And we also had another notice that there was a shooting where someone fired a gun into the air.\n\nOn top of that, it's really not a very aesthetic place to live. They've promised to put in grass in the lower area, and it still turns into nothing but mud every time it rains and looks terrible. Yes, the parking is also pretty bad during the evenings.  Also, the apartments are quite old. Most were built in the 70s, except for the one in the front building where it burned a year or two ago and they completely renovated it.  (They say that some of their apartments are renovated, and really this is the only one that I've seen that is. Because it burned down.) if you do a Google search for it you'll find it. \n\nI still have half of a year left on my lease in this place. And I definitely won't be renewing it. Their maintenance team tries hard, but they take 2 to 3 days to show up. When our apartment was broken into, the door latches were replaced but they didn't fit properly, and every time there was any kind of humidity in the air, our door wouldn't lock easily from the outside and it took them a couple of days to get here. So I almost had to risk not locking my door when I would leave. \n\nThere are some other things that I've noticed about this place, like the stray cats, the garbage area that just sits outside, but take my advice and look somewhere else to live. It's not terrible, it's definitely not the cheapest place, but there are a lot of other nicer places that I have seen around here. The only reason I moved in here is that I was looking for a place with very little advance notice and it was the only place that had apartments available. """,Y
34060101594,"b'Google Bexar County property  search, get to the street, and use overhead map from there to select the property.  This will at least get you the street number, deed history (if any), tax valuation, etc.'",Y
27583248954,"b""I'm interested hear more of the inside info you got.\n\nWhen you say Google has hired two people to fiber in SA do you mean two different companies to install fiber infrastructure around the city?\n\nWhen you say they are working with city staff, I am curious what does that mean exactly?\n\nDo you know if it worked out to lease the dark fiber that CPS has in the ground already?""",Y
40492628807,"b'Your comment was removed because it appears to have included a phone number, if this was your own phone number, consider either having people DM you for your contact information, or [message the mods](https://www.reddit.com/message/compose/?to=/r/sanantonio) to override this removal.\n\n*I am a bot, and this action was performed automatically. Please [contact the moderators of this subreddit](/message/compose/?to=/r/sanantonio) if you have any questions or concerns.*'",N
27234295756,b'[I think its this. ](https://m.facebook.com/groups/r.sanantonio?refsrc=https%3A%2F%2Fm.facebook.com%2Fgroups%2Fr.sanantonio&amp;refid=9&amp;_rdr#_=_) ',Y
27260075664,"b""They're a Facebook heavy establishment. This is the event [page](https://www.facebook.com/events/670447823047513/). Here is their [Facebook page](https://www.facebook.com/the.Beethoven). Hope this helps!""",Y
36117329728,b'St Phillips is the only school with a cardiovascular technology program. Trains you to be a cath lab tech. Good to use as a base for PA school.',Y
26507339268,b'Google and I have no idea where this is.',Y
37086636369,b'I put Facebook now lol',Y
27221768374,"b""It's in the sidebar but it's https://www.facebook.com/groups/r.sanantonio/""",Y
37134071915,"b""There you go making shit up again.\n\nI don't want your acceptance and you aren't showing ANY liberal view points. You're an auth left.\n\nLib right is on the conservative spectrum. You can't ignore the fact that far lefties like you have pushed the bar so far left that the conservative right now includes classical liberalism.\n\nLets look at some other conservative right-leaning + liberal-leaning centrist views:\n\n* Mega corps like facebook and twitter are guilty of creating monopolies and censoring dissent at the behest of the left to interfere with the election.\n* Mega corps like Amazon and Walmart supported the lockdowns to kill small business and force people under their thumb and destroy the middle class.\n* CRT is a racist belief system that should be banned from government funded training and schools.\n* Middle east intervention needs to cease; Bush and Obama are both equally as guilty of it.\n* The drug war is racist and should be abolished.\n* There's nothing wrong with gay marriage.\n* Trans people don't belong in gender segregated sport systems.\n* Children should not be allowed to transition.\n* Police need more accountability for their actions; however defunding the police is a terrible idea.\n\nMany of those are also in line with traditional conservatism; some are not. **You do not understand what liberalism is. Classical liberalism is now right of center - authoritarian leftists like you pushed it there. Progressives are not Liberals.**""",Y
31124701092,"b'Or, I think that Americans have fallen into cultlike beliefs about the imagined ""need"" to pay executives vastly more than executive talent is actually worth.\n\nExecutive talent isn\'t exactly super common, but neither is it precious above all other commodities and worth tens of millions. I\'d argue that executive talent is probably more common than significant programming talent, and the top programmers don\'t get paid what executives do.\n\nThe idea that you can\'t get a quality executive without paying them obscene amounts is a myth, a lie invented by executives to justify huge salaries nothing more or less.'",Y
41263851237,"b""https://www.zippia.com/advice/highest-paying-jobs-in-austin-tx/\n\nDon't believe the hype. The best paying jobs are essentially doctors, engineers, computers, professors and executive management. Look at https://livingwage.mit.edu/counties/48015 and you'll see that even a nearly 6 figure salary isn't gonna go as far as some might expect. \n\nUnless the manufacturing or service and support industry ramps up the salary divide in Austin is going to remain wide.""",Y
39860341497,"b'""one that is outwardly powerful or dangerous but inwardly weak or ineffectual""\n\nThe term was coined by Chinese communist leader Mao.'",Y
